{
  "name": "meridian-usage-staging",
  "version": "0.2.0",
  "description": "Meridian AI usage and capability controls (staging)",
  "mcpServers": {
    "meridian-usage-staging": {
      "command": "uvx",
      "args": [
        "--python",
        "3.13",
        "--from",
        "git+https://github.com/phawhan/meridian-usage@v0.2.0#subdirectory=backend",
        "meridian-connector",
        "--env",
        "staging"
      ]
    }
  },
  "contextFileName": "GEMINI.md",
  "settings": [
    {
      "name": "Directory user ID",
      "description": "Who the connector acts as (simulated identity; in production this comes from single sign-on).",
      "envVar": "MERIDIAN_USER"
    }
  ]
}
